idx,sentence
1333,"but eager as he was to be a soldier, he scarcely dared touch on the"
2941,"The widow, occupied as she had been with the cares of a great dinner,"
1096,Strong as Madame Esmond's belief appeared to be respecting her son's
2827,"I , unworthy as I am , represent the sole hope of the royal family ."
2484,"“Why, I declare the Shoes look just like my own,” said one of the clerks, eying the newly-found treasure, whose hidden powers, even he, sharp as he was, was not able to discover."
3354,"reprobate as he was, was a man of talent; his conversation was a thousand"
1044,"All of these details, foolish and sentimental as they may seem, go to"
1652,"Gerda knew every flower; and, numerous as they were, it still seemed to Gerda that one was wanting, though she did not know which."
3006,"sewed up those corduroys, tight as they were."
457,"I , unworthy as I am , represent the sole hope of the royal family ."
3754,"But they were all taken in by the image of the King, for, clever as they were, the Mermaid was still cleverer, and all they could do was to help the Fairy of the Desert to make a wonderful monument over what they thought was the grave of the King of the Gold Mines."
3761,"Frightful as this encounter was the King’s courage was unshaken, and by the aid of his wonderful sword he cut them in pieces one after the other."
1893,"The King himself, old as he was, could not help watching her, and telling the Queen softly that it was a long time since he had seen so beautiful and lovely a creature."
642,"So everything went on for a long time, until at last, happy as she was, Beauty began to long for the sight of her father and her brothers and sisters; and one night, seeing her look very sad, the Beast asked her what was the matter."
813,"After much consideration, he answered: “You tell me yourself that the Beast, frightful as he is, loves you dearly, and deserves your love and gratitude for his gentleness and kindness; I think the Prince must mean you to understand that you ought to reward him by doing as he wishes you to, in spite of his ugliness.”"
2413,"“No, indeed, you shall not do that,” said the bailiff; “I am the one to do that.” And, big and fat as he was, he went out as briskly as a boy."
2695,"He ordered the troll-witch who had rolled the apple to him to be torn in pieces between four-and-twenty horses, so that not a bit of her was left, and then for the first time they began really to keep the wedding, and, weary as they were, the sheriff, the attorney, and the bailiff kept it up too."
3480,"several times, as loud as he could."
1282,"Fond as they all were of one another, the two eldest could not help being glad to think that their dogs certainly had a better chance."
2716,"Yet, cowardly as he was, he had not quite the heart to kill the Princess and her baby outright, but he had them put in a huge brass-bound chest and thrust out to sea, that they might either be drowned or starved, or perhaps come to a country where they would be out of his way."
2731,"Prisoner though he was, the King of the Sheep had still some powers and privileges."
2822,"Short as Miranda’s absence had been, it had seemed like a hundred years to the King of the Sheep."
2554,"Now Jaqueline saw that the Giant , big as he was , courageous too , was afraid of his wife !"
2812,"Presently Suliman made a sign with his hand that the people should be silent, and said: “I have accepted the crown you have offered me, but only that I may keep it for Prince Darling, who is not dead as you suppose; the Fairy has assured me that there is still hope that you may some day see him again, good and virtuous as he was when he first came to the throne."
572,"“It’s a mercy,” he said, “that they didn’t root up the tree on which I was perched, or I should have had to jump like a squirrel on to another, which, nimble though I am, would have been no easy job.” He drew his sword and gave each of the giants a very fine thrust or two on the breast, and then went to the horsemen and said: “The deed is done, I’ve put an end to the two of them; but I assure you it has been no easy matter, for they even tore up trees in their struggle to defend themselves; but all that’s of no use against one who slays seven men at a blow.” “Weren’t you wounded?” asked the horsemen."
1234,"“For,” he said, “however flourishing we may seem to foreigners, we are in danger of an invasion from the island of Blefuscu, which is the other great empire of the universe, almost as large and as powerful as this of his Majesty."
2171,"“You, indeed!” said the brothers, “you look as if you were fit to be among such great lords, nasty beast that you are to sit there!”"
1455,Encumbered as he was with a double armful of girl and a fairly heavy
3053,"a fool as you seem to think, Racey."
813,"He ran about the room, dug in all the boxes and drawers, and even looked under the bed in search of a piece of bread, hard though it might be, or a cookie, or perhaps a bit of fish."
2332,"Then, clever as I am, I can earn a lot of money."
3950,Funny though I mean I've never known problem before.
1043,"But they were all taken in by the image of the King , for , clever as they were , the Mermaid was still cleverer , and all they could do was to help the Fairy of the Desert to make a wonderful monument over what they thought was the grave of the King of the Gold Mines ."
1099,"Frightful as this encounter was the King 's courage was unshaken , and by the aid of his wonderful sword he cut them in pieces one after the other ."
3394,"As he spoke, his nose, long though it was, became at least two inches longer."
283,"The King himself , old as he was , could not help watching her , and telling the Queen softly that it was a long time since he had seen so beautiful and lovely a creature ."
1974,"Strange though it may seem, the Dog could not swim."
3295,"Lightly clad as he was, he started out toward the village."
1720,"Its population, large though it was, was composed wholly of boys."
3139,"So everything went on for a long time , until at last , happy as she was , Beauty began to long for the sight of her father and her brothers and sisters ; and one night , seeing her look very sad , the Beast asked her what was the matter ."
3869,"After much consideration , he answered : `` You tell me yourself that the Beast , frightful as he is , loves you dearly , and deserves your love and gratitude for his gentleness and kindness ; I think the Prince must mean you to understand that you ought to reward him by doing as he wishes you to , in spite of his ugliness . ''"
3614,"And , big and fat as he was , he went out as briskly as a boy ."
101,"He ordered the troll-witch who had rolled the apple to him to be torn in pieces between four-and-twenty horses , so that not a bit of her was left , and then for the first time they began really to keep the wedding , and , weary as they were , the sheriff , the attorney , and the bailiff kept it up too ."
1600,"several times , as loud as he could ."
2641,trustworthy as the local police and other authorities believe you to
967,"Fond as they all were of one another , the two eldest could not help being glad to think that their dogs certainly had a better chance ."
956,"Yet , cowardly as he was , he had not quite the heart to kill the Princess and her baby outright , but he had them put in a huge brass-bound chest and thrust out to sea , that they might either be drowned or starved , or perhaps come to a country where they would be out of his way ."
1802,"Prisoner though he was , the King of the Sheep had still some powers and privileges ."
2140,"Short as Miranda 's absence had been , it had seemed like a hundred years to the King of the Sheep ."
2109,"`` Old as I am , '' replied the cobbler , `` I have very good eyes , and will you believe me when I tell you that I sewed a dead body together in a place where I had less light than I have now . ''"
2619,"improbable though it might be, and had just been nailed down"
1758,"The goldsmith at once knew how it had come to pass, and that the children had eaten the heart and liver of the golden bird, and in order to revenge himself, and because he was envious and hard-hearted, he said to the father, “Thy children are in league with the Evil One, do not take the gold, and do not suffer them to stay any longer in thy house, for he has them in his power, and may ruin thee likewise.” The father feared the Evil One, and painful as it was to him, he nevertheless led the twins forth into the forest, and with a sad heart left them there."
2872,"Presently Suliman made a sign with his hand that the people should be silent , and said : `` I have accepted the crown you have offered me , but only that I may keep it for Prince Darling , who is not dead as you suppose ; the Fairy has assured me that there is still hope that you may some day see him again , good and virtuous as he was when he first came to the throne ."
2173,"So he said it thrice more, but also in vain: “Confounded girl that you are, get up!” cried he, “Get up, or it shall be worse for you!” When he had said that, St. Peter suddenly appeared in his former shape as a discharged soldier; he entered by the window and said, “Godless man, what art thou doing?"
268,"`` It 's a mercy , '' he said , `` that they did n't root up the tree on which I was perched , or I should have had to jump like a squirrel on to another , which , nimble though I am , would have been no easy job . ''"
3906,"late as it is."""
4005,"Span's owner shook his head; devoted though he was to his dog, he felt"
2853,"Since thou pridest thyself on being a master-thief, I will put thy art to the proof, but if thou dost not stand the test, thou must marry the rope-maker’s daughter, and the croaking of the raven must be thy music on the occasion.” “Lord count,” answered the master-thief, “Think of three things, as difficult as you like, and if I do not perform your tasks, do with me what you will.” The count reflected for some minutes, and then said, “Well, then, in the first place, thou shalt steal the horse I keep for my own riding, out of the stable; in the next, thou shalt steal the sheet from beneath the bodies of my wife and myself when we are asleep, without our observing it, and the wedding-ring of my wife as well; thirdly and lastly, thou shalt steal away out of the church, the parson and clerk."
1920,"But busy though they seemed , they found time to whisper to each other : ` If we can only get hold of that basket it will make our fortune ! '"
2938,"Father Grumbler stared in silence for an instant , and then he began to swear so loudly that even his family , accustomed as they were to his language , wondered at him ."
3615,"he added: ""Naughty as you are, you're the life and soul of the party."""
619,"Now the queen 's eyes were very sharp , and it seemed to her that the man who stood before her , tall and handsome though he might be , was different in many slight ways , and in one in particular , from the man who had fought the tourney ."
2564,"But , frightened though they were , they did not forget to beg the lightning to take off the wolverine 's coat and to free his legs , but to be careful not to hurt him ."
735,"I really think that , bad sleeper as I am , I might have a good night on it ."
2848,"Small as their possessions were, they had one thing they could not do without, and that was a horse, which contrived to live upon the grass found by the side of the highroad."
3952,"shouted the breath of the wind, as loud as it could."
766,"He reminded her of the old mandarin, and the crooked-legged field-marshal-major-general-corporal-sergeant, but she wept so bitterly, and kissed her little chimney sweep so fondly, that he could not do otherwise than as she wished, foolish as it was."
3454,"""Good and obedient as she is to"
2110,"She shrank in terror , but , slight as was the noise , the thing heard it , and raised its head to listen ."
901,"such stealings, great though they be, have little or no effect in"
1193,"This match, however, brilliant as it was, seemed not to the mother's taste."
2331,"Man, preeminent though he is in the animal kingdom, capable of reacting"
1137,"front it today exhibits are not comprehended; and, fastened though it is"
2216,"States, young as it is, is ripening rapidly, and the Socialists claim,"
3987,"But , industrious as he was , he could hardly buy bread and cheese for himself and his wife , and they grew thinner and thinner daily ."
4045,"From dawn to dark he stood on the banks of the little stream , without hooking anything better than an eel , or a few old shoes , that even he , clever though he was , felt were not worth mending ."
907,"Old though she was , it seemed impossible to tire her ."
3344,"Thus the little moments,     Humble though they be,   Make the mighty ages     Of eternity."
4004,As tight as you can.
2314,"But pleased though the boy was , he determined not to tell anyone about it , particularly not his mother , who never could keep anything from her neighbours ."
1800,"They had been very happy all these years , but they would have been happier still if they had had any children ; but old though they were they had never made up their minds to do without them , and often they would sit over the fire and talk of how they would have brought up their children if only some had come to their house ."
2573,"Of course , if the eagle himself was there to protect them even the lindworm , big and strong as he was , knew that he could do nothing ; but when he was absent , any little eaglets who ventured too near the ground would be sure to disappear down the monster 's throat ."
1136,"When he was made fast , the young man began to blow softly on his flute , and bound though he was , the king 's body moved to the sound , up and down the fir tree till his clothes were in tatters , and the skin nearly rubbed off his back ."
3095,"As pervasive as Logic is in human affairs, it's not limited to purely human use."
1149,"` Bitter as it was to me , I was forced to go when she bade me , and I have wandered about ever since , with grief gnawing at my heart ; for how can a masterless man , without money or goods , ever hope to win the lovely Lucia ? '"
3309,a gent like Bill Gregg--fine fellow though he is--what d'you think I
3359,"So they came near the door to get a peep, and who should come out but the King himself, as handsome as you please, and no other but King Whiskers himself."
379,"Well, Donald was a shrewd fellow, and, downhearted though he was, began to think if he could get any good out of Daisy's death."
1297,"as comfortable as he could behind a log, although he longed to stand"
1269,"The old woman said it had not, and that nothing could compensate her for the loss of it, for she had reared it herself; that there was never before seen such a cat for catching mice; that a cat, spotted as that one was, was seldom found; and that it was of the rare breed which gave rise to the common saying:"
913,"But the woman had been fond of the Black Rogue , thief though he was , and she shrank from the Shifty Lad in horror , and set the people after him , and he had to fly to another part of the country where none knew of his doings ."
1319,"I am the person you want , ' they all exclaimed at once , and the attendant , as much bewildered as the chamberlain had been , desired them to follow him into the king 's presence ."
336,"At first the little creatures, many though they were, could hardly stir the heavily loaded truck; but the Woodman and the Scarecrow both pushed from behind, and they got along better."
3965,"And dumb and stupid as this may sound to you... what I can never be, not ever... is Japanese."
2516,"but it's stays pretty cold even, uh, during the Winter, for as nice as it is."
502,"She got used to find him absent by day , and they spent a happy twelvemonth together , and at last a beautiful little boy was born ; and happy as she was before , she was twice as happy now , for she had her child to keep her company in the day when she could n't see her husband ."
2909,"But lone white swans though ye be, ye shall keep for ever your own sweet Gaelic speech, and ye shall sing, with plaintive voices, songs so haunting that your music will bring peace to the souls of those who hear."
3473,"am I not able to do it again, tall and strong as the two uf you haf"
1255,"And one said to him, 'Far would it be from the mind of Dermat to await thee here, knowing as he does that his life is in peril.'"
402,"But everything came back presently, as vivid as it had been"
2308,"Even the King, indifferent as he was, sometimes looked at the little fellow with sad tenderness, noticing how cleverly he learned to crawl, and swing himself about by his arms, so that in his own awkward way he was as active as most children of his age."
1784,"Lame as he was, anybody could see he was born to be a king."
1827,"For somehow, boy as he was, when he heard he was born to be a king, he felt like a man like a king who could afford to be tender because he was strong."
2199,"He had been angry ever since he learned how his uncle had taken the crown and had felt as if, king as he was, he should like to strike him, this great, strong wicked man."
451,"well, it really wasn't quite, as bad as you thought, was it, was it?"
1958,"This seemed to the girls more and more wonderful , but tired and sleepy as they were , they thought no more about it , but crept into the little beds , drew the coverlets over their heads and were soon asleep ."
2,"Idiot though he was , he was never unhappy , but always thanked gratefully those who fed him , and sometimes would stop for a little and sing to them ."
1704,"The young man pulled up and removed his cap , for , idiot though he was , he knew that when you have to do with people greater than yourself , a cap is more useful in the hand than on the head ."
2567,"For miles round the country was bare , for the enemy had cut down every tree and burnt every blade of corn ; and , idiot though he might be , Peronnik was able to grasp that inside the gates men were dying of famine ."
1585,"And at his braying the animals came running , numerous as the stars in the sky , so that scarce was I able to stand among them ."
3125,"But , rapid as the pace was , it was not rapid enough for Bellah , who stooped and said : ` The swallow is less swift than the wind , the wind is less swift than the lightning ."
1022,"He had been a few paces behind the others during the black-jack incident, but, dark as it was, he had seen enough to show him that the occasion was, as Smith would have said, one for the shrewd blow rather than the prolonged parley."
1056,"Reluctant as they might be to abandon their fallen leader, it must be done."
1854,"""I am loath,"" observed Smith, ""to interrupt this very impressive brain barbecue, but, trivial as it may seem to you, to me there is a certain interest in this other little matter of my ruined hat."
3132,"But , quick though he was , Gudu had been quicker still , and nothing remained but some drops of water ."
1518,"Affrighted though she was, Wendy swelled with pride."
1954,"They were his dogs snapping at him, but, tragic figure though he had become, he scarcely heeded them."
2517,"Inconsequential though they may seem, there is a"
2270,"What could the bewildered scouts do, masters as they were of every war-like artifice save this one, but trot helplessly after him, exposing themselves fatally to view, while they gave pathetic utterance to the coyote cry."
2293,"Thus terrible as the sudden appearance of the pirates must have been to them, they remained stationary for a moment, not a muscle moving; as if the foe had come by invitation."
2476,"I will follow them , ' said the duckling to himself ; ` ugly though I am , I would rather be killed by them than suffer all I have suffered from cold and hunger , and from the ducks and fowls who should have treated me kindly . '"
4080,"“I don't think so,” said the first twin, as clever as the others."
198,"Fine gentlemen though he was, the intensity of his communings had soiled his ruff, and suddenly he knew that she was gazing at it."
2183,"Misguided man though he was, we may be glad, without sympathising with him, that in the end he was true to the traditions of his race."
1717,"In a country which is full of wild beasts of all sorts there once lived a jackal and a hedgehog , and , unlike though they were , the two animals made great friends , and were often seen in each other 's company ."
1230,"This was followed by a voice , hoarse as that of a bull , which cried : ' I smell the smell of a man . '"
3583,"She was too late ; the dawn was already breaking , and the head fell to the ground , dead and corrupt as it was before ."
48,"She went skipping slowly down the outside walk, thinking him over and saying to herself that, queer as it was, here was another person whom she liked in spite of his crossness."
943,"But , quick as she was , Eglantine , her maid of honour , had time to see where she went , and jumped from the carriage in pursuit of her , followed at a distance by the guards ."
2254,"As she gazed a thrill ran through her , for she felt that , worn and wasted though he was by illness , it was the face of her destined husband ."
2557,"But , small as she was , she made herself so heavy that , after staggering a few steps under her weight , he laid her down , and tied her fast to a tree with some of the ribbons of his hat ."
2873,"These words , low though they were spoken , reached Becasigue , who could hardly believe his ears ."
1578,"Trembling with rage though she was , she dared not show it , and only laughed hideously . '"
2048,"But , low as she spoke , the giantess caught the words , and began to laugh ."
2704,"Just as she had finished speaking the six thousand frogs returned , looking so strange with bees sticking to every part of them that , sad as she felt , the poor queen could not help laughing ."
2588,"Joyful indeed was the old man as the cows went into their stables , and he beheld the rich milk that flowed into the pail of the golden-haired maiden with the silver comb ."
2980,"` Surely I can catch him , good swimmer as I am , ' to himself ."
3054,"` Surely I , good fisher as I am , can catch him , ' said Covan son of Gorla ."
3090,"And, uh, in general though I've, I've been really disappointed with a lot of other centers I've worked at, and it, all and all"
3232,"And now , as to your reward , you shall in truth take your sister home with you , and your brothers I will restore to life ; but idle and unfaithful as they are their lot is to wander for ever ."
3685,"By dint of spying through keyholes and listening at doors , he learned that the king , old and ugly though he was , had fallen in love with the Princess Bella-Flor , who would have nothing to say to him , and had hidden herself in some mountain castle , no one knew where ."
1456,"Shut in and morbid as his life had been, Colin had more imagination than she had and at least he had spent a good deal of time looking at wonderful books and pictures."
235,"He looked up at the sky, flushed and glowing with the strangely new exercise, slight as it was."
996,"It was the first time Mary had heard of them, either, but even at this stage she had begun to realize that, queer as he was, Colin had read about a great many singular things and was somehow a very convincing sort of boy."
3165,nice though aren't they?
3580,"Mortally wounded as he was , the Stalo was not yet dead , and managed to swim to the shore ."
1348,"But, strange as it seemed to him, there were minutes—sometimes half-hours—when, without his knowing why, the black burden seemed to lift itself again and he knew he was a living man and not a dead one."
2202,"Sick and giddy as Mowgli was he could not help enjoying the wild rush, though the glimpses of earth far down below frightened him, and the terrible check and jerk at the end of the swing over nothing but empty air brought his heart between his teeth."
3683,"Sore, sleepy, and hungry as he was, Mowgli could not help laughing when the Bandar-log began, twenty at a time, to tell him how great and wise and strong and gentle they were, and how foolish he was to wish to leave them."
3754,unfathomable as it was mysterious and as mysterious as it was
2697,"Angry as he was, Rikki-tikki was very frightened as he saw the size of the big cobra."
2363,"A camel had blundered into it, and wet and angry as I was, I could not help laughing."
1994,"The blade was always bright and clear ; each time she looked she had the happiness of knowing that all was well , till one evening , tired and anxious , as she frequently was at the end of the day , she took it from its drawer , and behold !"
3600,"And the maiden believed what the prince told her ; and in the morning when he put on his lion 's form she took a knife and slew him , and cut him up very small , and burnt him , and cast his ashes into the water , and out of the water came the prince , beautiful as the day , and as glad to look upon as the sun himself ."
2412,"“Damn her, maybe she's got company there's lights, late as it is.”"
3962,"The accidental discovery, just made, that the proprietor of the Temperance Tavern kept liquor on his premises, scarcely fluttered the public pulse, tremendous as the fact was."
1789,"` Do you , rich as you are , need help ?"
1974,"And she spake to her and said : ` Do you , rich as you are , need help ? '"
2083,"And the Wind looked on her and knew her again , for he had seen her in the cottage and in the palace , and he spake to her and said : ` Do you , rich as you are , want help ? '"
