idx,sentence
235,"For as simple as it was, it was probably the hardest learning experience I ever had, because it was archaic."
3179,conscious as you are—that it has committed a crime.” And he bowed me out
2791,"Perhaps, paradoxical as it may seem, this perpetual unreadiness may be,"
4003,"fortunes as the case may be during the winter, will make a great virtue"
2362,"have made up to now, great though it has undoubtedly been, has not been"
1847,"Sorely tempted as I was to signal further, I refrained for fear of"
1854,knowing as we do that every German consul is bound to send secret
2436,"made further investigations, convinced as I was of the shady nature"
2285,As efficient as this blood deliver system is though....it has its limits.
2188,Disordered though my faculties
2764,"Outstanding as were his other merits, he was not good at keeping"
2460,"exchanges in which, generous donor though he was, he had received"
2840,"Incredible as it seemed, Battling Billson"
2254,"unconscious as he was that it had been a caress, meant, she knew, so"
2374,"longed as she always did, to content it."
191,"And these are things like thalidomide, that of course everybody knows about, and of course, tragic and terrible as it was, the fact is that it affected just four hundred and fifty children."
3646,"paid for; that, soothing as it may be to the soul to lie for three hours"
1790,"the foot of those witch-cottage stairs, while she, as frightened as they"
367,"that isolation, right and natural and torturing as her needs were for"
1945,unrivaled as is the political sagacity with which they consolidated
3231,"loathsome as he is, the wanton, thoughtless tortures inflicted upon him"
2870,As interesting as it would be to trace this Bill and the subsequent
2439,"place, enticing as travelling is--and I appreciate fully its"
97,"Faraday was firmly persuaded that, great as had been these"
2064,"Bad correspondant as I am, I"
3522,"of the Mistress, great and reverend goddess though she was, was so"
1246,Poor though it be to bandage wounds that bleed
701,Mighty as these men had each been
636,"propaganda, popular as it may be in our own day."
3409,"As good as you are, though, I know full well how much better you can be and it's with that spirit that I've prepared a message today."
1789,"Deplorable as the custom may be, this ancient vulgarity has,"
1612,Lovely though isn't it?
1304,"clerical and domestic novels, remarkable as they exhibit it, do not"
1960,"Daft as it seems, we could have won it because the kick was produced too quick  for Paul Simpson and we hit the ball later on, Mark Stein's a little back header, very unlucky not to win it for us."
1886,subtle as can be ?
2485,"His eyes were half-closed, as though the light, dim though it"
3301,"you, mad though you are."""
3041,"himself, then Dunbar, then, naked as they, Jabez."
3852,As brief as I can be sir.
2117,"And the way people will talk about you, the way some day, as young as you are, try to imagine some of us, the way your grandchildren will talk about you."
3324,"about the face and legs, but bitter as their experience was it"
338,But clever as this device was it still left them without Lashly's
444,"and tired as they were,"
992,"had stumbled upon a penguin rookery, but interesting as it was to"
3499,"As hard as I've tried, I can't save them."
2349,"consideration, balanced as they are against the coal expenditure.'"
151,"were made, the dogs pulling splendidly, and anxious as Scott was"
1238,"Well as daft as it seems Dennis as you probably know in this sort of game you're on the roads very late at night and when you're on the roads very late at night, you get a lot of bored policemen"
1289,"We've demonstrated the direct link between investing in community support and reduced crime levels and we believe that programme, valued as it is in local communities, has a message larger and wider for policy makers in the United Kingdom."
3354,"As important as those motions are, we have also missed some very important ones which I think should take priority."
2216,"Um, as... as flattered and intimidated as I am by your proposition, why me?"
3477,But angry as he was
34,"as clever as some believe, not to have discovered in six months what we"
3613,Um as flattered and intimidated as I am by your proposition why me?
3531,"If we find some creatures, not as smart as we are, I think they would make interesting subjects to explore what they are made of, how they work, what's their biology, what do they eat, do they eat, maybe they just receive sunlight."
3465,"woman as she is, has been marked for the assassin’s knife if she"
3762,"famished as herself, were fighting over the repast."
1736,"One of my favorite movies of all time, racist though it may be, is ""Network"", about commercial television."
3401,"“Drunk as I am, I don’t"
4007,"form, light as the burden was, would certainly be beyond the strength"
2267,"impulsive child as I should have done, I sent her from me--cast her out"
1025,As loud as he could.
1891,"hard as they had worked before, White set a livelier pace and made"
2194,"You had obviously heard something and as... preposterous as the idea is, it has certainly affected you."
582,"her ears, but his look of agony smote her, angry as she was."
2415,"You had obviously heard something and as... preposterous as the idea is, it has certainly affected you."
4066,"Well, as ludacris as that sounds, you've got a deal."
224,"As hard as it is, we go to the shop, we go to another gig, we go and have a beer, we go and enjoy life and we don't let them rob us of that."
1642,"have been paying no attention to those rifts, small as they are, that"
2118,"Now, erm, the, even dedicated person though I am, ex-workaholic, erm, there is no way that I can find sixteen uninterrupted hours in one month."
2663,"Where they come into their own, is let's say that you wanted to phone me in July because my wedding anniversary is in July, you could turn to the back of the July calendar card, write down call Ricky Elliot on the seventh, because it's his wedding anniversary, erm, and write down my, my telephone number and then distressing though I find this idea, you could forget the whole thing, confident in the knowledge that the system will remind you at the appropriate time as to what action you should take."
2897,"Treacherous and cruel as she had been, the"
1100,"Er, it's because we don't write down the stuff, we're not as pr , precise as we could be."
2563,"that, brave though they were, they could do no more."
2778,"raging torrent of his fate, beaten as it was between the contending"
2217,"Look, Tony, when you fried the tower to stop Ultron, we knew this wouldn't be easy, but, as awesome as Thor and I are, tech's not our thing."
3978,"But, favourable as this would be to us, it is generally considered here"
50,"little anoying that, that to do list, as friendly as flextible as it is, is mandatory."
932,Sad as our losses are--and the gallant _Lutzow_ has sunk in sight of
176,"receipt of this news, trivial though the delay has been, threw a mantle"
2991,"As rare as this type of galaxy is, another more distant,reddish (and unnamed) ring galaxy can be seen through Hoag's object, between the nucleus and the outer ring of the galaxy, at roughly the one o'clock position in the picture to the right."
630,Incredible as it may seem to
1980,"Promiscuous as we are, we are undoing the"
3529,"I think, as difficult as it is, I've told my son that I think he could"
148,"Well, as pissed as a news anchor can be."
2271,"Vicious as he was, Amelia"
2976,"never heard; and she knew that, faulty as their deeds might be, they"
3957,"Low as they were, the words held a"
897,gorgeous as I do.
3291,"As weird as it feels to still be saying this, the president would like to see you at the White House."
1114,"As anxious as we are to see this thing fly, um, we still haven't seen it fly—we saw it fly away."
195,"general silence of the woods, contrasting as it does in its loud,"
3735,"Great as the number of trout they eat undoubtedly is, I do"
1667,"ineffectual though my gift of poesy may be, yet I will not let those"
1196,"Unbelievable, I mean  I've always looked upon the horse as a nice horse not as the winner of an Arkle."
2231,"Now, incredible as this sounds,"
3784,as uninteresting as one might expect from its appearance.
1282,"Great as my expectations had been, they were more than fulfilled."
3759,"As amazing and inspiring as these three individuals are to me, I am most inspired by my grandson Gavin."
1014,"the soul, and, moreover, strange as it may seem, this Mussulman English"
2146,"They lack confidence, simple as that and one of the things is that as a group you come in and you probably look at people when you  and you look at the trainers and the idea is that early on people can do, can keep some eye contact  gonna stare you out  but just keeping your eyes and don't flit away and also when you're under pressure at this stage his eyes challenge you or something like that, then your eyes go down."
1878,"For me, as intrigueing as the torus and ETs and free energy are, the most compelling question was:"
2670,"As difficult as it was for me,"
771,"As difficult as it may be for Americans to accept,"
1151,"As sick as it sounds, it makes sense, that they would be better positioned to succeed, in their quest for absolute control, if there are fewer of us to manage."
2763,"as quick as we find a way, to catch them they think of something else"
3088,As utopian as this can sound at first
1151,"As nice as it was otherwise ,"
3474,"Equal to all normal people, very embarrassed, what differeciated me from the entire family incredible as it may seem to you."
220,"""Mr. Finck's reading, wide as it is, is not wide"
102,"""Sweet Mother, I cannot weave my web, broken as I am"
2451,"As great as Barcelona are, as great as Real Madrid and"
315,"Abhinavagupta writes in his notes on the relevance of ideas related to Shiva and Yoga, by stating that ""people, occupied as they are with their own affairs, normally do nothing for others"", and Shiva and Yoga spirituality helps one look beyond, understand interconnectedness, and thus benefit both the individual and the world towards a more blissful state of existence."
1900,lithified as it were and constitute the strata of the psychozoic
3574,"trivial as it was in itself, yet was as enlightening as the white paper"
1130,remorseful as he stood and looked at her.
1178,"As basic as it gets, it's primarily three brain areas: the ventral tegmental area, the nucleus accumbens, and the prefrontal cortex."
3928,"As important as these may be,"
913,"Within a union as large, as diverse, as it is, the sectional conference has, in our case, helped allay many of these fears and concerns and our own clothing and textile industry is still as active as ever."
2307,"technique, divorced as it is from its purpose, its use or final"
2969,"of the exodus, universal as it is, there is an urge of elemental"
2441,"As good as Tohdoh is, if we don't know the overall situation..."
2908,"haunted, as the negroes said it was."
2546,"Unfinished though it was, the picture showed that;"
728,childish; Peter was as well aware of that as anybody could be.
2982,bewildered as he felt.
380,"I submit that, selfish as it all seems when I"
3353,happy as I could remember having been for years.
112,"Nivers; and their voices, deep bass as they were, sounded like Beverly's"
2493,"Young as they are, there"
3124,As good as you make me feel
3139,"Ungentle and unlovely as it was, it was the"
1332,"For, young as we were, the"
1712,"Child though I was, I felt"
2460,"From my perspective, it is to help parents of children with disabilities to not put their child in a box, but let them be all they can be, however little though that may be."
3349,"It is no wonder that, schooled by their events, young as we were, we put"
2322,Bad as that is it?
881,"Badly led though they were, they wrested the valley north of"
3162,"met his eyes with a full straight stare, trembling though I was, and I"
1056,"Cold though it was, I crawled stealthily out of my warm sleeping-bag and"
819,"Privacy or privacy as they seem to say these days, don't they, sometimes?"
889,"fanciful as you did, so as them charity ladies didn't smell a rat."
2183,"nevertheless, great though Sir John Tozer might be, the owner's"
523,"Weary though he was, he could not sleep"
2941,"And our faith is not in our creed, vital though that is, important though it is, it does matter what we believe, but even more important than that, and foundational to that, it matters who we believe!"
2690,"content as she was, as most of her friends were, as the newspapers"
1997,scarce as I always do when my creditors are after me.
2348,"surprise as she recognized him, and stepping forward, offered her hand."
2914,opinion as we are to ours.
3252,As bad as we are.
2830,"It's proper that we should be asking in the context of these proposals for  boundary changes, affected as they are by the decision of the er  first of all the French national assembly and now the French government to  make life difficult for the other member states as far as the  ratification of these proposals are concerned, it's right that we should be asking what is the position of the British government in relation to these matters."
3173,"Erm I'm er rising to take the opportunity to sum up the debate er for those of us on this side of the house and to say that on this side of the house we do  welcome these orders actually coming through, delayed though they are and er besmirched though they are by the usual examples of government incompetence in failing to send them to the scrutiny committee in the proper manner to allow the usual processes to take place but wi that's par for the course these days."
747,"The capping limits, unfair and arbitrary as they are, are again imposing a straight jacket."
1434,"Erm some days have been better than others but I I I have in retrospect enjoyed it,heartbroke though it is."
3994,"Bad as the army was, it was not"
3841,"As dangerous as this situation is,"
1485,"And, as easy as that sounds, the notion of set is something that mathematicians had to wrestle with very carefully in the 1900s."
1833,"As frustrating as it can be, we forget people's names, birthdays, and other things we'd like to remember."
3895,"So as awful as the DOM is, JavaScript with the DOM is an effective programming environment."
2712,confused as all her other sensations swept Mrs. Travers off her feet.
3918,Reprehensible as it was he did not want anything to
3447,"You know, as many as it takes to fill it up."
2331,"One course tired us out, weary as we already were with our journey, but"
2632,"Hard as this### is to admit, it gets to me sometimes"
1323,"It will be wrong however, to conclude that the department's role is entirely directed inwards towards N C V O effectiveness, vital though that is."
1144,Tiny as it was all Ipek seemed to
355,"Brilliant machine though this is, all it is, really, is just a circuit."
2266,"like a good-natured giant, towering as he did high above our heads."
2486,alarming as she drew nearer and nearer.
268,"most delicious, made as they were by your own royal and beautiful"
1255,"largely for the man of initiative; and, uncomely block as he was, Rankin"
1593,"But not even then, child though he was, did he"
321,"As twisted as it may have been, he loved."
2308,"criminals as they actually are, this problem will remain unsolved."
2847,"smashing as their impact appears, might as well be confetti for all the"
2153,Hard up as we are for shell he thinks it best to blaze it away freely
544,"who looked like earth to earth, caked as they were with mud, haggard"
1327,"attitude is heroic but not, I think, so dangerous as it is"
2335,"If you're going to, if you're going to provide the service you have to be careful that it, it is being effective, as effective as it can be, does it need to be more effective and should it be operating all week."
3806,Valuable as these agents are when deep
2218,"body, for, surprising as it may seem, the distance from the crown to"
3720,"As excited -- as aroused -- as we might find ourselves by this imagining of Milton actually playing Comus, of course his performance in that role can't be asserted in any way definitively.Now as I mentioned, the title of this piece was originally A Mask Presented at Ludlow Castle, and it seems actually to have been known by the reading public by this title for a good hundred years or so."
110,"It was one thing for the Lady to imagine -- you know, crazy as it was, for the Lady to imagine -- a rescue squad of angels to zip to her aid at the first hint of a physical assault."
1456,"I realize that is my privilege to have a relatively stable position in the university, access to resources, dwindling as they are."
1795,child as you seem to think.
38,As ready as I can be.
3193,"interest, for, accustomed as he was to traversing the depths of space,"
3889,"dismissed with a laugh; it never entered his head, prejudiced as he was,"
2178,"Your Honor, reasonable or not, we're obliged to stick to the facts as brought out at the original trial."
2393,unreasonable as it would be unkind.
1220,"Anticipated as this issue was, it"
1438,"got a  colour like Jenny's, wine though it is"
1539,"You can't hear a thing, deaf as the, deaf as a post, and doesn't wear any thing, I feel it's very one side conversation because he, he says all the talking and they can't muck in  almost unbearable, cos she likes to talk a lot to and she couldn't get a word in because"
1258,"""As high as it can be, rise up and fly."""
1605,"He said that as small and as weak this ram apparantly was, it came with horn it attacked it with strong force, brought it to the ground and broke all its horns."
1556,"To me, as controversial as it may seem, it doesn't draw for there really is no moral line at all when the circumstances of the person are considered."
904,"Because we all know, corny as that sounds, the secret to living is giving."
3525,"I wish her well, hard as that is for me to"
3421,"large as we possibly can, not related to m and n.m And then the probably collision is going to be about 1/q."
1527,"slaves throughout the South, completely ignorant as were the masses so"
2922,"me shelter than upon the recognition, agreeable and cordial as it was."
3172,As remarkable as the amount of people you've managed to murder.
2778,"Bad as the Welsh chieftains were, even they would"
780,"and his advisers were as yet quite unfitted for it, prone as they were"
2160,marked as it was by brilliant strategy on the part of the young
1533,"Washington wrote on February 16, 1778, ""Naked and starving as they are we cannot enough admire the incomparable patience and fidelity of the soldiery."""
3227,"Then, worn out though he was by his long sickness, Stanislaus raised"
1994,"as it may sound, condensed as it is in these pages."
3838,"things, incomplete as it may be in many of its details, leaves no room"
1729,"""This is a really amazing moment, and people are going to comment on it, and they're going to ""like"" it, as weird and inappropriate as that is in this case."
2010,"""As bad as it seems now, as dark as your life may feel, there is light at the end of the tunnel, and it does get better."""
661,"As magical as it is, it's just as unpredictable."
1083,"long and it's and it's, it's about the same colour as Hattie's, a bit darker"
88,"Hungry as we can be,"
3337,"Big Reuben, clever as he was known to be."
2441,"wonder that even Tom, experienced miner though he was, should have been"
539,"As good as those dishes are, I always wish there as something going on on the table."
1007,"clock in the tower, his smile, altruistic as it was, became slightly"
1313,"though, good fellow as he was."
3653,"captured and tortured, strong and fierce though he might be, it was"
1155,"Worried though he was about the impending Filippeschi attack, Simon's"
3736,"Kindly as King Louis was, decapitation would be preferable"
1893,"Numerous as they seemed, the"
1504,Certain as the judgment of God it is that Simon and the man in black
4045,"that, mad as it was, delighted in seeing how powerfully he was drawn to"
3887,"of of of everything, er, she said, as you raised, you been appeared in the paper, obviously, in dealing with something, it seemed to you, unjust, our folks thought you ought to introduce this subject."
817,Interesting as was the provincial life of this community; absorbing as
449,"The fanlight pattern, good as it is, fails"
3484,"Crude as these fixtures were, they have hardly"
135,"Unusual as is the use of these Palladian windows, their charm is"
3331,"Beautiful as these doorways are in themselves, they are so much heavier"
2098,"Not just a School of Public Health, important as that was -- there had been a small school before and it's much larger and better now -- but public health as an idea, the idea that you can prevent illnesses, that behaviour contributes to a healthier society, that laws and policies and regulations can encourage healthier behaviour and reduce disease."
1962,"every species of authority, inimical as they were to each other in"
2681,Slow as they want.
2829,"As awful as it is, the consort tried to kill the Crown Prince."
3504,"The process seemed a sound one to Brand, unable as he was to reach the"
824,♪ And foolish though it may seem
2964,"Come back to reality, as hard as that may be?"
47,"Come back to reality, as hard as that may be?"
3538,"irritable, though he may fail to grasp what his friend is after."
808,"such ugly things--faces, vivid, changing as he looked, growing ugly and"
1153,"possible to sneak out, even on Dr. Grant, absent-minded as he was, by"
38,"Big as it is, the Orion nebula is just part of an even larger star-forming area known as the Orion complex."
3792,"as careless as you wish, and no one thinks anything about it."""
3225,"so, and if, on the whole, perishing as I was, I would not be justified"
544,"grace as I could, of course, and said I enjoyed it, and tried not to be"
4030,"heavy as they had been higher up, but they were very many."
964,"active as he was, he suddenly gave a great leap out of the net and was"
2305,"All these things, however, fascinating as they are and copious as is"
3174,"Yet even these, deplorable as they ever must be regarded,"
3854,"learned historian and geographer though he was, computed the equatorial"
1147,"strange fatality this fact, well authenticated as it is, has been"
840,"He preferred, fleeting and weak spirit as he was, the indefinite,"
1413,Chained as she is
1827,Unsupervised as you would say.
3327,"Mr. President, as wise as you are, you cannot presume to know what God is thinking."
206,"information as it is, our conclusions seem to depend on whether we have"
3275,"refined as they are, it would be quite impossible for men to do"
2326,"- Getting in Elliot's head, as odd as it seems, is, you know, something I really enjoy, youknow,to go  intohispsychosis, whathe'ssufferingthrough, thegoodin him, thebad,theugly."
1515,"once, as crazy as I ever see a bunch of critters."""
1955,"anxiety as she spoke, slowly and thoughtfully, her gaze searching his"
2525,As hard as they let me.
1484,"going to let you get the drop on him, as you seem to think you can."
3261,"That moment of Lucy's peril, brief as it was,"
1497,"improbable as it seems, there is more reason to believe than there is to"
1513,"There's some diffuse radiation that's coming from the atmosphere that gets, scattered as the sun is coming through the atmosphere."
1739,"is a heretic, shame though it be, and her master is the father of lies."
3058,"Quick as he was, the great cat was"
3092,"time he is holding his mother's gown, old man though he be, and"
3502,As bad as that right.
326,"These injuries, severe and painful though they were, are only a small part of the story when compared to the effects of the severe closed head injury."
453,"Cribbed and confined as the girl was, she steadily refused to be cast"
2634,"with the maid, because it seemed to me that her heart, young as it is"
2777,"My blessing follows her, unbeliever though she be."""
293,"Furtive as he was, he paused to brush them from his head and hair."
2234,"Degraded as his tribe had become, Burl"
2128,"short-sighted as all ants were, no longer felt itself threatened and"
3780,"might, herculean as their efforts might be, they were powerless against"
1584,rest--short as it was--had enabled him to rise and stagger on.
251,"Barbaric and strange as he seemed, the girl found in his face that"
2664,"Strong as he was,"
3605,"foolish, as is the manner of dignified dogs when they are spilled"
1266,As good as we want to be maybe we just can't get beyond color.
1421,"Maybe if we just had a racial Squeaky Fromme, as scary as that is, people would come to their senses."
3891,"Strange as this may seem to us, yet if we bear in"
2842,and convincing as it leads the reader through the maze of business
2259,"It's not other people, it's not the problems that surround us, it's not the people that we have to work with or the conditions in work, it's not the next door neighbours, terrible though they may be, the real answer, for you and for me, lies within ourselves."
3096,"In a way though, perverse though it sounds, I'd rather let it get fairly bad and take him back"
591,Very lonely though I imagine.
3267,as extraordinary as some of his secretary's utterances.
