sentence_idx,sentence
884,We haven't started that yet but it will more of a smaller three to four people one on one with the teacher.
885,My host family is great.
886,I have a mother and her husband who works for the government so he actually is stationed four hours away.
887,We have two siblings who are seven and eight a boy and a girl and we also have our grandfather living with us.
888,I love talking with my mom every night and during meals it's a lot of fun.
890,It's really cool to be in a family because there is a lot of similarities but there is a lot of differences too so it's interesting to see how people on
891,literally on the other side of the world live.
892,It's usually not a nuclear family.
893,"Here it's like parents, kids, aunts and uncles and grandparents all live together sometimes."
894,Jaipur is like a city on fast forward and condensed.
895,There are just so many people and it's a really ineresting combination of the historical past of India with the boldness of now.
896,"Jaipur is really different from home because here it's a lot louder, there's a lot of people the traffic here is crazy,"
898,I feel like Jaipur has become a second home because I feel comfortable and there's my host family and sometimes they remind me of family back at home.
899,I'm really surprised by how quickly you transform to where you are living.
900,I think a lot of times in the West we look at women for example and we're like if only they stood up for themselves or if they just take off the veil and just go for it but when you're living here you realize that everyone is rational and that there is a reason people have for living the way they do.
902,If you have a taste for adventure and if you are a very open minded person and you're not afraid of having everything you know in your life questioned and challenged then do MSlD and if you want to become a real cosmopolitan to have an idea of life outside of the Western bubble if you wanna know what that is like then you are the person that MSlD is really for.
905,"I believe that it is really important how much we have learned through this project, how incredible organizational skills are needed to arrange a staying for 60 people in Poland."
908,"We believe that this can help us in the future to understand people who we are going to do business with, who we're going to be in contact with not only professionally but also socially."
909,"Cooperation of academic circles and student organizations is crucial as this is the moment when we, as students, are actually able to establish first relationships with the professional world."
910,"We believe that this is critical to understand how the business works, how we can help each other."
912,I think what matters is what the universities could do better.
914,"Moreover, they have to rejuvenate."
915,The personnel and the authorities have to rejuvenate.
916,I absolutely love the Brazilians for their sense of timing which is totally different than the Polish sense of timing.
917,"These are people who are so incredibly relaxed, conflictless and stress-free that sometimes it might be a bit disturbing but their sense of timing, their kindness and hospitality are probably the best things I've encountered."
918,Actually even after two weeks spent together in this international company it is possible to understand their mentality and attitude much better.
919,"Some of their actions and behaviours which at first seem to be a total abstraction or even inappropriate, then turn out to be absolutely normal in their culture, not perceived wrong."
920,Now the first thing once you understand an atom is that you can move on to understanding an element
927,Now the Periodic Table of Elements organizes these elements based on their chemical and physical properties
928,We're going to have a whole lot of videos about the
931,From the hood to Japan!
933,What?
934,from the hood to Japan
935,Harajuku girls - What?
936,Its all love.
937,What?
938,Give it up!
939,What?
940,"shouldn't matter, shouldn't matter, shouldn't matter, shouldn't matter"
945,shouldn't matter shouldn't matter shouldn't matter
947,"See, I'd have all the money in the world"
948,If I was a wealthy girl
949,"No man could test me, impress me my cash flow would never ever end"
952,I'd buy everything!
953,Clean out Vivienne Westwood in my Galliano gown
954,"No, I wouldn't just have one hood a Hollywood mansion if I could please book me first-class to my fancy house in London town all the riches, baby won't mean anything all the riches baby won't bring what your love can bring all the riches, baby won't mean anything there ain't no other, baby your lovin' is better than gold and I know!"
955,If I was rich girl
957,"No man could test me, impress me my cash flow would never ever end"
958,'cause i'd have all the money in the world if I was a wealthy girl
959,I'd get me four Harajuku girls too to inspire me and they'd come to my rescue
960,I'd dress them wicked
962,"Love, Angel, Music, Baby hurry up and come and save me all the riches, baby, won't mean anything all the riches, baby, won't bring what your love can bring all the riches, baby, won't mean anything there ain't no other, baby your lovin' is better than gold and I know"
965,it's all love - what?
966,give it up - what?
968,What?
970,From the hood to Japan
971,Harajuku girls
972,What?
973,It's all love
974,What?
975,"Give it up shouldn't matter, shouldn't matter, shouldn't matter, shouldn't matter"
976,What happened to my life?
977,Turned upside down chicks that blew your mind DlNG it's the second round original track and ting you know you cant buy these things!
978,No!
979,"See, Stefani in the LAMB I brought the fetish - people, you know who I am!"
981,I hope you can all keep up
982,We climbed all the way from the bottom to the top
983,Now we ain't gettin' nothing but love
984,If I was a rich girl
985,"See, I'd have all the money in the world"
986,If I was a wealthy girl
987,"No man could test me, impress me my cash flow would never ever end because I'd have all the money in the world"
988,If I was a a wealthy girl
989,Welcome to week one of this equine nutrition course.
990,We're going to begin by
991,looking at equine digestive tract anatomy.
993,looking for you to be able to describe the anatomy of the gastrointestinal tract of the horse.
997,"In it's natural environment, the horse will roam over somewhere in the region of 80 kilometers per day, and in that sense, we consider horses as nomadic animals."
998,The horse will graze little and often.
1001,The other aspect of the natural environment of the horse is a social aspect.
1006,"For example, if you're riding down the road and the carrier bag blows out of the hedge, your horse will typically run off and then stop and have a look to see what it's actually running from, so that's the flight aspect."
1009,"language, and therefore, they're very good at picking up our body language, but they do also communicate through vocalization as well."
1010,"So having considered the fact that horses graze on a little and often basis for a considerable amount of the day, we now have to have a think about the types of diets that they're designed to process."
1011,"The gastrointestinal system is set up in such a way to deal with high amounts of low quality forage, as I said, ingested on an almost continual basis."
1012,"So what we're seeing here is, is that the principal diet of the horse should be forage, because that is the type of feed that the gastrointestinal tract has evolved to process."
1013,"Having considered the diet, we also have to think about how we manage horses and how this differs from their natural state, if we think about the stabled horse, this is a huge departure from the natural state."
1016,"Even when we think about horses who are kept out to pasture, these are typically much smaller areas than the horse would encounter in a natural state."
1018,"Not only have we changed the way we manage our horses, we've also changed the way that we use them."
1021,leisure or sport horse.
1023,levels of more energy dense feedstuffs in the diet.
1024,"For example, if we think of the race horse, the race horse has high energy requirements to undertake the level of work that is required, and because of that, we think about the natural diet of the horse which is this low quality fiber that couldn't sustain that level of energy requirement."
1026,"Typically, we've done this through the provision of cereal grains in the diet, for example, oats, barley, and maize."
1027,"Not only have we changed the types of feedstuff, we've also changed the feeding management."
1028,"So where the horse has evolved to eat at an almost continual basis, we've moved away from that towards meal-feeding."
1029,"We'll often feed our horses two large meals in the day, two large meals of cereal grains in a bucket for them."
1031,"Unfortunately, the other aspect that's important to consider is that the amount of grains that we're feeding often over shadows the amount of forage."
1032,"So when we think back to the natural environment of the horse and we know that forage should be the natural component, we've often moving away from this providing much more cereal grains in the diet."
1033,"What we know from a lot of research that's been done is, there is a minimum requirement of forage to maintain gut health and integrity, and that is one kilogram of dry matter of forage per hundred kilograms of live wheat according to the"
1035,"So whilst the intestinal system of the horse has remained largely unmodified, we've actually changed how we're feeding these animals and the types of foodstuffs that we're including in the diet."
1036,"And, unfortunately, we're encountering some problems associated with this and these problems can result in serious health implications."
1037,"Horses can develop a number of disorders such as gastric ulceration, hindgut, acidosis, azoturia, laminitis, and colic."
1038,Some of you may have had horses who've suffered from these disorders.
1039,Some of you may know of horses who've had these problems.
1040,"Perhaps one of the most famous horses who have suffered from laminitis for example, is that of"
1042,"So therefore, in terms of the outcomes from horses, for horses suffering from these conditions, this can range from poor performance due to irreparable damage of the gastrointestinal tract, and in very severe cases, euthanasia of the animal."
1045,"It is also important that we understand the behavioral needs of the horse, so that we can maintain good welfare, and ultimately, we want to develop dietary management regimes that avoid or even overcome this diet-related problems."
1046,(Image Source:
1047,Paul Wilkinson)
1049,"There are only four days left before, what many are calling, one of the most important polls in Greek history."
1050,Most experts credit the election's importance to the seemingly imminent exit from the Euro and possibly the introduction of a new currency.
1051,Euronews has more.
1055,"""The truth is that Greece is already crumbling."
1058,Leaving the EU is one thing.
1060,"""The Greek banks would see their balance sheets wiped out as their domestic bond holdings would become worthless."
1061,"Inflation would increase significantly, and the new currency would depreciate."
1062,"Moreover, a default by both the Greek public and private sectors on their foreign debt would follow."""
1063,"But when the country's longest-serving foreign bank looked into what could happen to its growth, the outlook wasn't as bleak."
1064,The Business Mirror has the Standard Chartered
1066,"""We [assessed] the effects of a Greek exit from the European Monetary Union on our footprint markets of Asia, Africa and the Middle East."
1067,If contagion is contained by European Central
1068,"Bank [ECB] liquidity injections, which is our core scenario, any negative impact on emerging-market growth is likely to be limited and temporary."""
1069,"Nouriel Roubini, who predicted a deep economic crisis for Greece in 2006, wrote Greece must exit the EU but not necessarily the currency."
1070,"In an article for Project Syndicate, Roubini said the state is stuck in a vicious cycle of insolvency."
1072,"Fund (the ""Troika""), that minimizes collateral damage to Greece and the rest of the eurozone."""
1073,"Speigel Online International has reported no matter what the results from the June 17 election say, the EU still plans to discuss backing off the terms of its international bailout for Greece."
1074,"So, in these next few videos, we're gonna continue our discussion of the minimum cost spanning tree problem."
1075,"And I'm gonna focus on a second good algorithm, good greedy algorithm for the problem, namely Kruskal's algorithm."
1076,"Now, we already have an excellent algorithm for computing the minimum cost spanning tree in Prim's algorithm."
1078,"Well, let me give you three reasons."
1079,"So the first reason is this is just a, it's a cool algorithm."
1080,It's definitely a candidate for the greatest hits.
1081,It's something I think you should know.
1082,It's competitive with Prim's algorithm both in theory and in practice.
1084,"The second reason is it'll give us an opportunity to learn a new data structure, one we haven't discussed yet in this course."
1085,It's called the union-find data structure.
1086,"So, in exactly the same way or in a similar way to how we used heaps to get a super fast implementation of Prim's algorithm."
1087,We use a unionfind data structure to get a super fast implementation of Kruskal's algorithm.
1089,"The third reason is, is there's some very cool connections between"
1092,I'll discuss how natural greedy algorithms in a clustering context are best understood as a variance of
1093,Kruskal's minimum spanning tree algorithm.
1094,So let me just briefly review some of the things I expect you to remember about the minimum cost spanning tree problem.
1097,That is a subgraph which has no cycles and is connected.
1098,"There's a path between each pairs of vertices and amongst all potentially exponential many spanning trees, the algorithm is supposed to output the one with the smalle st cost, smallest sum of edge costs."
1101,"that said, Kruskal's algorithm actually extends in a really, just easy, elegant way to the case where G is disconnected."
1102,But I'm not going to talk about that here.
1104,"Now don't worry, Kruskal's algorithm is just as correct."
1105,If there are ties amongst the edge costs.
1107,"Finally, of the various machinery that we developed to prove the correctness of"
1108,Prim's algorithm perhaps the most important and most subtle point was what's called the cut property.
1109,So this is a condition which guarantees you're not making a mistake in a greedy algorithm.
1111,"And remember, the cut property says, if you have an edge of a graph and you could find just a single cut for which this edge is the cheapest one crossing it."
1112,Okay?
1115,So we'll definitely be using that again in Kruskal's algorithm when we prove it's correct.
1117,I think you'll find it very natural.
1119,So the graph has seven edges and I've annotated them with their edge costs in blue.
1120,So here's the big difference in philosophy between Prim's algorithm and Kruskal's algorithm.
1121,"In Prim's algorithm, you insisted on growing like a mold from a starting point, always maintaining co nnectivity, and spanning one new vertex in each iteration."
1122,Kruskal's gonna just throw out the desire to have a connected subgraph at each step of the iteration.
1123,"Kruskal's algorithm will be totally content to grow a tree in parallel with lots of simultaneous little pieces, only having them coalesce at the very end of the algorithm."
1124,"So in Prim's algorithm, while we were only allowed to pick the cheapest edge subject to this constraint of spanning some new vertex."
1126,Kruskal's algorithm we're just going to pick the cheapest edge that we haven't
1127,looked at yet.
1128,"Now, there is an issue, of course, we wanna construct a spanning tree at the end."
1129,"So, we certainly don't wanna create any cycles, so we'll skip over edges that will create cycles."
1132,"Again, there is no starting point."
1133,We're just gonna look at the cheapest edge overall.
1134,So that's obviously this unit cost edge and we're gonna include that in our tree.
1135,Right?
1138,It's a greedy algorithm.
1139,So what do we do next?
1140,"Well, now we have this edge of cost two, that looks good, so let's go ahead and pick that one."
1141,Cool.
1142,Notice these two edges are totally disjoint.
1143,Kay.'
1145,"Now, it just so happens that when we look at the next edge, the edge of cost three, we will fuse together the two disjoint pieces that we had previously."
1146,"Now, we happen to have one connected piece."
1150,"Well, that would create a triangle with the edges of costs two and three, and that of course is a no-no."
1152,"So we skip over the four because we have no choice, we can't pick it, we move on to the five and the five is fine."
1154,"And now we have a spanning tree and we stop or if you prefer, you could think of it that we do, we do consider the edge of cost six."
1156,"And then, for completeness, we think about considering the seven, but that would form a triangle with the edges of costs one and five, so we skip that."
1157,"So after this single scan through the edges in assorted order, we find ourselves with these four pink edges."
1158,"In this case, it's a spanning tree and as we'll see, not just in this graph but in every graph it's actually the minimum cost spanning tree."
1159,"So, with the intuition hopefully solidly in place, I don't think the following pseudocode will surprise you."
1160,We want to get away with a single scan through the edges in short order.
1161,"So, obviously in the preprocessing step, we want to take the unsorted array of edges and sort them by edge cost."
1162,"To keep the notation and the pseudocode simple, let me just, for the purposes of the algorithm, description only, rename the edges one, two, three, four, all the way up to m conforming to this sorted order, right?"
1163,"So, the algorithm's just gonna scan through the edges in this newly found sorted order."
1165,"And now, we're just gonna zip through the edges once in sorted order."
1166,"And we take an edge, unless it's obviously a bad idea."
1168,"And that's it, after you finish up the for loop you just return the tree capital T. It's easy to imagine various optimizations that you could do."
1172,"So just like in our discussion of Primm's algorithm, what I wanna do is first just focus on why is Kruskal's algorithm correct?"
1173,Why does it output a spanning tree at all?
1174,"And then, the spanning tree that it outputs?"
1175,Why on earth should it have the minimum cost amongst all spanning trees?
1176,"That's when we're, once we're convinced of the correctness, we'll move on to a naive running time implementation and then finally, a fast implementation using suitable data structures."
1177,[sound].
1179,&amp;amp;gt;&amp;amp;gt; [foreign] &amp;amp;gt;&amp;amp;gt; We have one of the most unique charter school contexts in California.
1180,"In that, we serve one of the highest indices of"
1181,language learners which is upwards of 80% of our student population coupled with students in poverty who are 95% of our students qualify for our free or reduced lunch.
1182,&amp;amp;gt;&amp;amp;gt; [foreign] &amp;amp;gt;&amp;amp;gt; Two months ago an e-mail came to me from the
1186,&amp;amp;gt;&amp;amp;gt; I love teaching.
1187,I think I was born to be a teacher.
1188,[foreign]
1189,[laugh]
1190,I'm happy for the school because it's a great recognition for the program.
1191,It's a great recognition for the work that stands for the students supporting the high school so I'm very happy.
1192,[foreign]
1194,We are changing people's lives.
1198,&amp;amp;gt;&amp;amp;gt; I think this class is very helpful because I just came from Mexico few years ago.
1200,like unique.
1202,[clapping] &amp;amp;gt;&amp;amp;gt; Teaching in a intense charter school setting can almost be like dog years for a teacher.
1203,"So spending four years here can be like spending ten years at uh, you know school that exhibits less challenges and it's not quite as intense."
1204,&amp;amp;gt;&amp;amp;gt; [foreign].
1206,&amp;gt;&amp;gt; [foreign] &amp;gt;&amp;gt; For more please visit us at stanford.edu.
1207,The President:
1208,"Hello, Buckeyes!"
1209,(applause)
1211,It is good to be back at The Ohio State University.
1212,(applause)
1215,I love you!
1218,(applause)
1219,Get me walter bentley on the phone.
1221,I want to thank a couple of people.
1222,"First of all, the outstanding Mayor of Columbus,"
1223,Now.
1225,Mmm.
1226,(applause)
1227,Bmw...
1228,I want to thank OSU Provost Joe Alutto.
1229,Mercedes...
1231,Jaguar.
1233,"Hey, chico."
1235,Take care of her.
1237,Yeah.
1239,I'll take care of her.
1240,(applause)
1241,I haven't robbed anyone.
1242,"Now, let's face it, a presidential visit isn't even close to being the biggest thing this weekend on campus."
1243,I've been robbed!
1244,(laughter)
1245,Look at me!
1247,Do you think i dress this way?
1249,I'm an executive!
1251,383.
1252,I think Selinger is going to have a big game tonight.
1254,(applause)
1256,And I promise you I didn't do it because I knew I was coming here
1257,In the electric chair.
1259,One comb.
1262,So I genuinely think you guys are looking good.
1263,One pair of shoelaces.
1267,Earth to little abner.
1268,"You've got Ohio State, Ohio University, Xavier -- (applause)"
1270,-- Xavier is in -- Cincinnati.
1272,Audience:
1274,Booo --
1275,"Oh, god."
1277,"God, debbie, i'm so sorry."
1278,I'm not going to get in the middle of this.
1279,I'm really so sorry.
1280,(laughter)
1281,"Oh, don't be silly."
1284,So it's a testimony to Ohio basketball.
1285,I gotta cancel my credit cards.
1287,I gotta call high quality foods.
1288,And I want to thank Vijay for the outstanding introduction -- very much appreciate that.
1290,"Now, this is our last stop on a trip where we've been talking about an all-of-the-above energy strategy for America -- a strategy where we produce more oil, produce more gas, but also produce more American biofuels and more fuel-efficient cars, more solar power, more wind power, more power from the oceans, more clean and renewable energy."
1292,(applause)
1293,So if you'd just please take me there.
1294,More clean and renewable energy.
1296,"You know what I'm talking about here, because this school is a national leader in developing new sources of energy and advanced vehicles that use a lot less energy."
1298,I just had a chance to take a tour of the Center for
1299,I have to get back there right now.
1301,Spencer!
1302,"Now, I admit the best part of it was seeing the Buckeye Bullet, which has gone over 300 miles an hour and is now shooting for 400 miles an hour."
1303,"Spencer, i am not moving until you say yes."
1305,Yes!
1306,"And I asked the guys who were helping to design this whether mom was going to let them actually test-drive this thing, and the answer was no."
1307,Ye-Yes!
1308,(laughter)
1309,Yes.
1311,Yes.
1314,(applause)
1315,Whoa.
1316,The fastest in the world.
1317,Uh!
1320,(laughter)
1322,But it is a testament to the ingenuity here at Ohio State and what is essential to American leadership when it comes to energy -- our brain power.
1324,"I will say, though, when Malia gets her license in a few years, she will not be allowed to go 300 miles an hour."
1325,I felt like...
1326,(laughter)
1328,"Now, one of the reasons that I've been talking so much about fuel-efficient cars and new sources of energy is obviously because we're seeing another spike in gas prices right now."
1329,Oh.
1335,"Oh, yeah."
1337,"Trapped, lonely, and frustrated."
1338,"Right now, for most people you don't have a choice."
1339,"You know, you're stuck inside."
1340,"So when prices spike, that tax hike feels like a -- or that gas spike feels like a tax hike coming right out of your pocket."
1341,"You don't know how you got there,"
1342,That's part of the reason that we passed a payroll tax cut at the beginning of this year -- so that the average American would get an extra $40 in every paycheck to help offset the price of gas.
1343,But you're there.
1344,(applause)
1345,Yeah.
1347,Yeah.
1351,Like that recently.
1352,This happened this time last year.
1353,Really?
1355,Yeah.
1356,"It has been going on for years, for decades."
1358,"And every time prices start to go up -- especially during an election year -- politicians, they start dusting off their 3-point plan for $2.00 gas."
1359,Oh.
1361,Controlled by one person
1362,"Although this year, they decided it was going to be $2.50."
1363,Who could be so cruel.
1364,(laughter)
1366,This year they decided it was going to be $2.50.
1368,"Now, I don't know where they pick that number, $2.50."
1369,"You know, all you want to do is,"
1370,"Because it could have been $2.40, I guess."
1371,Experience the things that you can't reach.
1372,They could have said $2.10.
1373,"You know, like a baseball game"
1374,They could have said 50 cents a gallon.
1375,Or a--Or a dinner with a pretty girl.
1376,But they all make the same promise.
1378,"They head down to the gas station and they make sure a few cameras are following them, and then they tell you how we're going to have cheap gas forever if you just vote for them."
1379,"Well, i'm--I'm shy."
1380,And it has been the same script for 30 years -- the same thing.
1382,It has been like a bad rerun.
1383,Somehow i--I feel free.
